### ISSUE TITLE
MQTT

### ISSUE THREAD

**Issue by pdugas** [pdugas/recteq#5]
It's been suggested the cloud connection for the grill is via MQTT. This guy says he's been successful hijacking DNS to have his devices connect to a local MQTT server instead of the vendor's instance.

If I get on the firewall and sniff the grill's MAC address, I can see the periodic broadcasts to udp:6667 and when I fiddle in the app, I see additional traffic on tcp:8886. Perhaps that's MQTT. I wonder if we could do something similar to get async comm to the grill instead of relying on polling.

```shell
# tcpdump -n -i lag0 ether host ec:fa:bc:6a:d1:0e
tcpdump: verbose output suppressed, use -v or -vv for full protocol decode
listening on lag0, link-type EN10MB (Ethernet), capture size 65535 bytes
12:36:04.068514 IP 10.10.0.116.49154 > 255.255.255.255.6667: UDP, length 188
12:36:05.276415 ARP, Request who-has 10.10.0.116 tell 10.10.0.116, length 46
12:36:09.068083 IP 10.10.0.116.49154 > 255.255.255.255.6667: UDP, length 188
12:36:12.451077 IP 100.21.156.247.8886 > 10.10.0.116.44017: Flags [P.], seq 676013862:676014075, ack 2953521119, win 65535, length 213
12:36:12.595263 IP 10.10.0.116.44017 > 100.21.156.247.8886: Flags [.], ack 213, win 3615, length 0
12:36:12.656234 IP 10.10.0.116.44017 > 100.21.156.247.8886: Flags [P.], seq 1:214, ack 213, win 3615, length 213
12:36:12.739453 IP 100.21.156.247.8886 > 10.10.0.116.44017: Flags [P.], seq 213:282, ack 214, win 65535, length 69
12:36:12.842436 IP 10.10.0.116.44017 > 100.21.156.247.8886: Flags [.], ack 282, win 3546, length 0
12:36:13.967322 IP 10.10.0.116.44017 > 100.21.156.247.8886: Flags [P.], seq 214:427, ack 282, win 3546, length 213
12:36:14.049280 IP 100.21.156.247.8886 > 10.10.0.116.44017: Flags [P.], seq 282:351, ack 427, win 65535, length 69
12:36:14.080555 IP 10.10.0.116.49154 > 255.255.255.255.6667: UDP, length 188
12:36:14.092430 IP 10.10.0.116.44017 > 100.21.156.247.8886: Flags [.], ack 351, win 3477, length 0
12:36:15.298710 ARP, Request who-has 10.10.0.116 tell 10.10.0.116, length 46
12:36:16.154205 IP 100.21.156.247.8886 > 10.10.0.116.44017: Flags [P.], seq 351:564, ack 427, win 65535, length 213
12:36:16.336150 IP 10.10.0.116.44017 > 100.21.156.247.8886: Flags [P.], seq 427:640, ack 564, win 3264, length 213
12:36:16.421209 IP 100.21.156.247.8886 > 10.10.0.116.44017: Flags [P.], seq 564:633, ack 640, win 65535, length 69
12:36:16.595469 IP 10.10.0.116.44017 > 100.21.156.247.8886: Flags [.], ack 633, win 3195, length 0
12:36:17.999128 IP 10.10.0.116.44017 > 100.21.156.247.8886: Flags [P.], seq 640:853, ack 633, win 3195, length 213
12:36:18.082948 IP 100.21.156.247.8886 > 10.10.0.116.44017: Flags [P.], seq 633:702, ack 853, win 65535, length 69
12:36:18.092447 IP 10.10.0.116.44017 > 100.21.156.247.8886: Flags [.], ack 702, win 3126, length 0
12:36:19.067961 IP 10.10.0.116.49154 > 255.255.255.255.6667: UDP, length 188
12:36:21.155307 ARP, Request who-has 10.10.0.116 tell 10.10.0.1, length 28
12:36:21.445076 ARP, Reply 10.10.0.116 is-at ec:fa:bc:6a:d1:0e, length 46
```

**Comment by JamesHabben** [comment]
I've got a packet capture from 2020-10 where I joined the grill to my AP and sent some various commands. It's definitely MQTT. I did some reading about it back then and probably forgot most. Here are some of my notes.

The phone app made some initial DNS requests for `a.gw.tuyaus.com` and received 3 different IP addresses during the capture. The MQTT broker seems to be `mq.gw.tuyaus.com`. I get a not authorized error from that URL with MQTT Explorer when attempting.

MQTT seems to work with `topics` and has commands to interact like `subscribe` and `publish`. The topic broken out by wireshark looks like this: `p1234567/mb/az12345678901234AbCd2`. Based on what I found in the `kDefaultTuyaUserV2` key of the plist I extracted, it appears to be `partnerIdentity/mb/uid`.

**Comment by JamesHabben** [comment]
Dug into the capture some more and found what seems to be a key exchange from the phone app in HTTP prior to the MQTT traffic.

Request query string to `a.tuyaus.com/gw.json` looks like this:
`a=s.gw.token.get&gwId=xxx123xxx123&other={"token":"1abcdEFg","region":"AZ","tlinkStat":{"configure":"smartconfig","time":4,"source":"station_ap","path":"multicast"}}&t=9&v=3.0&sign=abc999abc999`

Response over HTTP in JSON:
`{"result":{"gwApiUrl":"http://a.tuyaus.com/gw.json","stdTimeZone":"-00:00","mqttRanges":"","timeZone":"-00:00","httpsPSKUrl":"https://a3.tuyaus.com/gw.json","mqttsUrl":"m2.tuyaus.com","mediaMqttUrl":"s.tuyaus.com","gwMqttUrl":"mq.gw.tuyaus.com","mediaMqttsUrl":"ms.tuyaus.com","mqttsPSKUrl":"m2.tuyaus.com","aispeech":"https://aispeech.tuyaus.com","dstIntervals":[[1583661600,1604221200],[1615716000,1636275600],[1647165600,1667725200],[1678615200,1699174800],[1710064800,1730624400],[1741514400,1762074000]]},"t":1600000000,"e":false,"success":true}`

**Comment by JamesHabben** [comment]
Then comes another HTTP POST to `a.tuyaus.com/gw.json`. The `gsId` and `token` values are the same between this and the last exchange. The `sign` value changed.

Looks like this:
`a=s.gw.dev.pk.active&gwId=xxx123xxx123&other={"token":"1abcdEFg"}&t=1600000000&v=3.0&sign=abc456abc456`

Response to that one in JSON. Interesting note is the `localKey` in this response does not match the `localKey` I pulled from my iPhone. The `uid` is the same value as above in the MQTT topic.
`"result":{"schema":"[{\"mode\":\"rw\",\"property\":{\"type\":\"bool\"},\"id\":1,\"type\":\"obj\"},{\"mode\":\"rw\",\"property\":{\"min\":0,\"max\":65535,\"scale\":0,\"step\":5,\"type\":\"value\"},\"id\":102,\"type\":\"obj\"},{\"mode\":\"ro\",\"property\":{\"min\":0,\"max\":65535,\"scale\":0,\"step\":1,\"type\":\"value\"},\"id\":103,\"type\":\"obj\"},{\"mode\":\"rw\",\"property\":{\"min\":0,\"max\":255,\"scale\":0,\"step\":1,\"type\":\"value\"},\"id\":104,\"type\":\"obj\"},{\"mode\":\"ro\",\"property\":{\"min\":0,\"max\":65535,\"scale\":0,\"step\":1,\"type\":\"value\"},\"id\":105,\"type\":\"obj\"},{\"mode\":\"ro\",\"property\":{\"min\":0,\"max\":65535,\"scale\":0,\"step\":1,\"type\":\"value\"},\"id\":106,\"type\":\"obj\"},{\"mode\":\"rw\",\"property\":{\"min\":-128,\"max\":127,\"scale\":0,\"step\":1,\"type\":\"value\"},\"id\":107,\"type\":\"obj\"},{\"mode\":\"wr\",\"property\":{\"type\":\"bool\"},\"id\":108,\"type\":\"obj\"},{\"mode\":\"ro\",\"property\":{\"type\":\"bool\"},\"id\":109,\"type\":\"obj\"},{\"mode\":\"ro\",\"property\":{\"type\":\"bool\"},\"id\":110,\"type\":\"obj\"},{\"mode\":\"ro\",\"property\":{\"type\":\"bool\"},\"id\":111,\"type\":\"obj\"}]","devEtag":"00000001ab","uid":"az12345678901234AbCd2","secKey":"zzzseckeyzzz","schemaId":"00000003f4","localKey":"zzzlocalkeyzz"}`

In between the request and response in this comment, some tuya MQTT server sends a `publish Message` with the topic I mentioned in an earlier comment. The JSON response just above follows immediately after.

**Comment by JamesHabben** [comment]
Edit in above: Correction on device. My notes had wrong IP addresses. My iPhone initiated all this traffic above. The grill didn't come in until later. Unfortunately, it looks like my iPhone and the grill communicated directly over wireless, so it didn't pass through my AP interface to capture in my packets. Seems the iPhone chats with the grill to get the important info, then negotiates with Tuya servers from the app. Once negotiated, it seems like the iPhone tells the grill to then query the `mq.gw.tuysus.com` domain with a `connect` and then `subscribe` MQTT message. Maybe not enough CPU in the grill controller than process all the key exchange stuff?

Lots of info to unpack here, but I think in short it would require a lot more reversing of the key exchange to get data from the MQTT broker. That or perhaps someone else who has experience with the Tuya API knows this is a more common exchange prior to MQTT.

On the plus side, I'm happy to see layers of security applied to what seems to be an otherwise "insecure" IoT protocol.

**Comment by pdugas** [comment]
Looks promising. Making notes on investigations like this public is appreciated. Storage is cheap (free here) so may as well us it, right? I appreciate the effort and sharing.

**Comment by JamesHabben** [comment]
If anyone can get the android app apk file, we could do a decompile of it and possibly find some of the routines for this process. Chances are pretty good it is implemented the same on both platforms.
